Document type;Document description
abk.passport.internal.type1;Abkhazia passport (green background,front)
abk.passport.type1;Abkhazia Passport
afg.id.type1;Afghan ID Card (Afghan emblem centered on top, front)
afg.id.type2;Afganistan ID Card (Emblem of Afganistan in up-right connor), front
afg.passport.type1;Afghan passport (Afghan flag in the background)
ago.id.type1;Angolan ID Card (emblem of country in left-upper connor, borders of country in the right-upper connor), front
ago.id.type2;Angolan ID Card
ago.passport.type1;Angolan passport (Angolan emblem in the upper right corner)
aia.passport.type1;Anguilla passport
alb.drvlic.type1;Albanian Driving License (Albanian emblem in the background)
alb.drvlic.type2;Albanian Driving License (Borders of Albania in upleft connor), front
alb.id.type1;Albanian ID Card (Albanian emblem in the background, front side, Albanian emblem in the background and top-left corner, back side)
alb.passport.type1;Albanian passport (Albanian emblem in the background)
alb.passport.type2;Albanian passport (Albanian emblem in the background and top-left corner, red horizontal line along the entire document)
and.drvlic.type1;Andorran driving licence (the emblem of Andorra in the top- left corner, card-sized)
and.passport.type1;Andorran passport (the emblem of Andorra on the right side, main page)
and.passport.type2;Andorran passport (the emblem of Andorra on yellow-blue backstage in the middle of page, main page)
and.passport.type3;Andorran passport (the emblem of Andorra on yellow backstage in the middle of page, main page)
and.rp.type1;Andorran residence permit (the emblem of Andorra in the top- left corner, card-sized)
are.drvlic.aj.type1;United Arab Emirates driving licence (the emblem of United Arab Emirates in the top-left corner)
are.drvlic.az.type1;United Arab Emirates driving licence (the emblem of United Arab Emirates in the top-left corner, four lines of document name, front side)
are.drvlic.du.type1;United Arab Emirates driving licence (the emblem of United Arab Emirates in the miidle on the top, front side)
are.drvlic.rk.type1;United Arab Emirates driving licence (the emblem of United Arab Emirates in the top-right corner)
are.drvlic.sh.type1;United Arab Emirates driving licence (the emblem of United Arab Emirates in the middle)
are.drvlic.type1;United Arab Emirates driving licence (the emblem of United Arab Emirates in the top-left corner, two lines of document name, front side)
are.drvlic.uq.type1;United Arab Emirates driving licence (the emblem of United Arab Emirates in the top-left corner)
are.id.type1;United Arab Emirates ID Card (the emblem of United Arab Emirates on the top in the middle, front side)
are.passport.type1;United Arab Emirates Passport (the emblem of United Arab Emirates on the right-top corner, main page)
are.rp.type1;United Arab Emirates Residence Visa
are.wp.type1;United Arab Emirates Work Permit (the emblem of United Arab Emirates on the top in the middle, bar code on the bottom in the middle, front side)
arg.drvlic.type1;Argentinian drvlic card (photo on the left)
arg.id.type1;Argentina ID card (sun on the background, barcode on the right down corner, front side)
arg.id.type2;Argentian ID Card (grey background, number duplicate in right area, front)
arg.id.type3;Argentian ID Card (grey background, number duplicate in right area, front)
arg.passport.type1;Argentinian Passport (white background and fingerprint on the right)
arg.passport.type2;Argentinian Passport (blue-pink background and fingerprint on the right)
arg.passport.type3;Argentinian Passport (white background and second photo in background)
arg.passport.type4;Argentinian Passport (Argentinian emblem in the background)
arg.vrc.type1;Vehicle Registration of Argentina (barcode on the top, front side)
arm.drvlic.type1;Armenian Driving License (stamp with Armenian emblem on the right, front)
arm.drvlic.type2;Armenian Driving License (stamp with Armenian emblem on the right, front)
arm.id.type1;Armenian ID Card (Armenian emblem on the background, front)
arm.passport.type1;Armenian Passport (new type, main page)
arm.passport.type2;Armenian Passport (line of patterns on the top, main page)
arm.visa.type1;Armenian visa (RA mark in the bottom-left corner)
atg.drvlic.type1;Antigua and Barbuda driving license (emblem in the upper right corner and fingerprint place in the bottom right)
atg.id.type1;Antigua and Barbuda ID card (emblem in the upper right corner and flag in the upper left)
atg.passport.type1;Antigua and Barbuda passport (golographic birds and tortille on the background)
atg.passport.type2;Antigua and Barbuda passport (flowers on the background and signature on the right)
aus.drvlic.act.type1;Australian Driving License - Australian Capital Territory (a white flower with blue edging, front side)
aus.drvlic.nsw.type1;Australian Driving License - New South Wales (a flower on the background and a copy of personal photo in the bottom- left corner, front side)
aus.drvlic.nt.type1;Australian Driving License (header on a brown background and a flower on the background of the document, front side)
aus.drvlic.qld.type1;Australian Driving License (national coat of arms on the background and a chip on the left, front side)
aus.drvlic.sa.type1;Australian Driving License - South Australia (the emblem of South Australia on the background, front side)
aus.drvlic.tas.type1;Australian Driving License - Tasmania (mark of Tasmania in the top-right corner, front side)
aus.drvlic.tas.type2;Australian Driving License - Tasmania (mark of Tasmania Government in the bottom-right corner, front side)
aus.drvlic.vic.type1;Australian Driving License - Victoria (a pink flower on the background, front side)
aus.drvlic.wa.type1;Australian Driving License - Western Australia (a swan on the background, front side)
aus.drvlic.wa.type2;
aus.id.act.type1;Australian ID Card (inscription of the name of a document on the background, front side)
aus.id.act.type2;Australian Capital Territory ID Card (Coat of arms of Canberra on the background, front side)
aus.id.nsw.type1;New South Wales ID Card (blue background, second photo in left area, front)
aus.id.nt.type1;Australian Northern Territory ID Card (flower in the upper left, front side)
aus.id.nt.type2;Australian Northern Territory ID Card (flower on the background), front side)
aus.id.nt.type3;Australian Northern Territory ID Card (Evidence of age, 18 Plus Card, flower on the background, front side)
aus.id.qld.type1;Australian ID Card (emblem of state on background, front)
aus.id.sa.type1;South Australian ID Card (Eagle and the inscription South Australia on the background, front side)
aus.id.tas.type1;ID Catd of Tasmania (Emblem od tasmanian animal in right- upper connor, front)
aus.id.tas.type2;ID Catd of Tasmania (Emblem od tasmanian animal in right- down conor, front)
aus.id.type1;Australian ID Card (The inscription 'KEYPASS' at the top, front side)
aus.id.type2;Australian ID Card (The inscription 'Australia Post' at the top, front side)
aus.id.type3;Australian ID Card (crocodiles on the backgrounds, front side)
aus.id.vic.type1;Australian ID Card (inscription of the name of a document on the background, front side)
aus.id.wa.type1;
aus.passport.type1;Australian Passport (a personal photo on the background, main page)
aut.asylum.rp.type1;Austrian Asylum Residence Permit (white background, front)
aut.drvlic.type1;Austrian Driving License (personal photo on the left and top-right)
aut.drvlic.type2;Austrian Driving License (Austria emblem on the top)
aut.id.type1;Austrian ID Card (red stripes on the left, back, Austrian emplem on the left)
aut.passport.type1;Austrian passport (eagle in the top-left corner, main page)
aut.passport.type2;Austrian passport (eagle in the top-left corner, main page)
aut.rp.type1;Austrian Residence Permit (Austrian emblem on the left, front, vertical red inscription on the left, back)
aut.rp.type2;Austrian Residence Permit (Austrian emblem on the left and biometrical symbol on the top, front)
aut.rp.type3;Austrian Residence Permit (Austrian emblem left top, front, )
aut.rp.type4;Austrian Residence Permit (Austrian emblem left top and bottom, front, )
aut.visa.type1;Austrian Visa (Austrian sign in the top-right corner, main page)
aut.vrc.type1;Austrian Vehicle Registration Certificate (green background and chip on the left)
aze.drvlic.type1;Azerbaijan Driving License (AZ sign in the top-left corner and the name of document on the top in the middle, front side)
aze.drvlic.type2;Azerbaijan Driving License (AZ sign in the middle and the flag of Azerbaijan near it, front side)
aze.id.type1;Azerbaijan ID card (Azerbaijan's coat of arms in the top- left corner, front side)
aze.id.type2;Azerbaijan ID card (Azerbaijan's flag in the top-left corner, front side)
aze.passport.type1;Azerbaijan Passport (country name in different languages via slash, main page)
aze.passport.type2;Azerbaijan Passport (biometric symbol in the top-left corner and Azerbaijan's coat of arms on the right side, main page)
aze.vrd.type1;Azerbaijan Vehicle Registration Certificate (document without a personal photo, AZ sign in the top-left corner and the flag of Azerbaijan near it, main page)
barcode;
bdi.passport.type1;Birundi Passport (color background and photo on the left)
bdi.passport.type2;Birundi Passport (color background and photo on the left)
bdi.passport.type3;Birundi Passport (color background and photo on the left)
bel.drvlic.type1;Belgian Driving License (the sign of the European Union with letter B in the top-left corner and the contour of country on the bottom-right corner, front side)
bel.drvlic.type2;Belgian Driving License (the sign of the European Union with letter B in the top-left corner and the contour of country on the bottom-right corner, front side)
bel.drvlic.type3;Belgian Driving License (the sign of the European Union with letter B in the top-left corner and the contour of country under the personal photo, front)
bel.id.type1;Belgian ID Card (chip on the left, front side)
bel.id.type2;Belgian ID Card (chip on the right, back side)
bel.id.type3;Belgian ID Card (chip on the left, front side)
bel.passport.type1;Belgian Passport (old sample)
bel.passport.type2;Belgian Passport (new sample)
bel.rp.type1;Belgian Residence Permit (chip on the left, front side)
bel.rp.type2;Belgian Residence Permit (biometric symbol in the top-left corner, front side)
bel.rp.type3;Belgian Residence Permit (parallelogram in the top-left corner, front side)
bel.visa.type1;Belgian Visa (BEL sign in the top-right corner, main page)
ben.id.type1;Benin ID Card (yellow background), front
ben.passport.type1;Passport of Benin (watermarks with the emblem of the republic of Dahomey, main page)
bfa.drvlic.type1;Driving License of Burkina Faso (the coat of arms of Burkina Faso in the top-right corner, front side)
bfa.id.type1;ID Card of Burkina Faso (a coat of arms on the background near the personal photo, front)
bfa.passport.type1;Passport of Burkina Faso ()
bfa.passport.type2;Passport of Burkina Faso (barcode in the middle of document, main page)
bfa.passport.type3;Passport of Burkina Faso ()
bgd.drvlic.type1;Driving License of Bangladesh (the stamp of Bangladesh Road Transport Authority on the background)
bgd.id.type1;ID Card of Bangladesh (the stamp with country borders in the top-left corner, front side)
bgd.passport.type1;Passport of Bangladesh (emblem of Bangladesh in the top- right corner, main page)
bgr.drvlic.type1;Bulgarian Driving License (sign of the European Union with letters BG in the top-left corner and the countour of country on the top in the middle, front side)
bgr.drvlic.type2;Bulgarian Driving License (a round stamp with letters BG on the right side, front side)
bgr.id.type1;Bulgarian ID Card (Bulgarian coat of arms on the right side, front side)
bgr.id.type2;Bulgarian ID Card (Bulgarian flag in the left-top corner, front side)
bgr.passport.type1;Bulgarian passport (round watermark in the middle of page, main page)
bgr.rp.type1;Bulgarian Residence Permit (flag of Bulgaria in the top-left corner and MN mark in the bottom-left corner, front side)
bgr.rp.type2;Bulgarian Residence Permit (biometric symbol in the top-left corner, front side)
bgr.visa.type1;Bulgarian Visa (BGR sign in the top-right corner)
bgr.vrc.type1;Bulgarian Vehicles Registration Certificate (outline of country on the background, page 2)
bhr.id.type1;Bahrain ID Card (Bahrain emblem on the top and chip on the left, front)
bhr.passport.type1;Bahrain passport (Bahrain emblem on the top, main page)
bhs.drvlic.type1;Bahamian Driving License (the national flag in the top-left corner and a personal photo on the left, front side)
bhs.drvlic.type2;Bahamian Driving License (the national flag in the top-left corner and a personal photo on the right,, front side)
bhs.id.type1;Bahamian ID Card (the contour of Bahamas on the background, front side)
bhs.passport.type1;Bahamian Passport (biometric symbol in the top-right corner, main page)
bhs.passport.type2;Bahamian Passport (biometric symbol in the top-left corner and the national flag in the top-right corner, main page)
bih.drvlic.type1;Driving License of Bosnia and Herzegovina (BIH sign in the top-right corner and the star on the backgroung, front side)
bih.drvlic.type2;Driving License of Bosnia and Herzegovina (BIH sign in the right area, front side)
bih.id.type1;ID Card of Bosnia and Herzegovina (a small personal photo on the right side and the star with triangle on the backgroung, front side)
bih.id.type2;ID Card of Bosnia and Herzegovina (stamp with BiH letters on the right, front side)
bih.passport.type1;Passport of Bosnia and Herzegovina (the contour of globus in the bottom-left corner of photo, main page)
bih.passport.type2;Passport of Bosnia and Herzegovina (a personal photo on the backgroung, main page)
bih.passport.type3;Passport of Bosnia and Herzegovina (a small personal photo in the top-right corner, main page)
blr.drvlic.type1;Belarusian Driving Licence (card-size, front side, horizontal)
blr.drvlic.type2;Belarusian Driving Licence (front side, vertical)
blr.id.type1;Belarusian ID Card (biometric symbol and Belarusian flag in the up-left corner, front, BLR sign on the right, back)
blr.passport.internal.type1;Belarusian passport (internal page)
blr.passport.type1;Belarusian passport (biodata page)
blr.visa.type1;Belarusian Visa (BLR sign in the top-left corner, main page)
blr.visa.type2;Belarusian Visa (Belarusian emblem on the left, main page)
blr.vrc.type1;Belarusian Vehicle Registration Certificate
blz.passport.type1;Passport of Belize (a small personal photo on the right side, main page)
bmu.passport.type1;Passport of Bermuda (emblem of Bermuda on the background)
bol.id.type1;Bolivian ID card (flag of Bolivia in the top-right corner, front side)
bol.passport.type1;Bolivian Passport (curved copy number and date of birth, main page)
bol.passport.type2;Bolivian Passport (with pdf417)
bra.drvlic.type1;Brazilian Driving License (Brazilian emblem in the top-left corner, front, green background, back)
bra.id.type1;Brazilian ID Card (Brazilian emblem on hte background, new type)
bra.id.type2;Brazilian ID Card (Brazilian emblem on hte background, old type, front)
bra.medcard.unimed.type1;Brazilian Medcard (Emblem of Unimed on the top right)
bra.passport.type1;Brazilian Passport (Brazil on hte background, main page)
bra.passport.type2;Brazilian Passport (barcode on the bottom, main page)
bra.re_license.type1;Brazilian Real Estate License (Brazilian emblem on the top- left corner, back, hummingbird in the middle, front)
bra.rp.type1;Brazilian ID Card (Brazilian emblem on hte background, new type)
bra.vrc.type1;Brazilian Vehicle Registration Certificate (green background)
brb.drvlic.type1;Driving License of Barbados (the contour of Barbados on the background, a coat of arms on the left side in the middle, front side)
brb.id.type1;ID Card of Barbados(a coat of arms of Barbados in the middle, front side)
brb.passport.type1;Passport of Barbados (the coat of arms of Barbados on the background and in the top-right corner of photo, main page)
brn.id.type1;ID Card of Brunei
brn.passport.type1;Passport of Brunei (the coat of arms of Brunei in the top- left corner, main page)
brn.passport.type2;Passport of Brunei (round stamps on the background and name of document is written on the tracery above the personal photo, main page)
btn.id.type1;ID Card of Bhutan (flag of Bhutan in left-upper connor, front)
btn.passport.type1;Passport of Bhutan (a small personal photo on the background in the top-right corner, main page)
bwa.drvlic.type1;Driving License of Botswana (the coat of arms under the personal photo and the countour of Botswana on the background, front side)
bwa.id.type1;Driving License of Botswana (the coat of arms under the personal photo and the countour of Botswana on the background, front side)
bwa.passport.type1;Passport of Botswana (the coat of arms of Botswana on the right side, main page)
caf.drvlic.type1;Driving License of Central African Republic (a coat of arms in the top-right corner, front side)
caf.passport.type1;Central African Republic Passport (photo on the left, small photo on the right)
can.drvlic.ab.type1;Canadian Driving License (a barcode in the bottom-right corner, front side)
can.drvlic.ab.type2;Canadian Driving License - Alberta (a round stamp on the right, front side)
can.drvlic.bc.type1;Canadian Driving License - British Columbia (flag of British Columbia on the background and the coat of arms of British Columbia on the right, front side)
can.drvlic.bc.type2;Canadian Driving License - British Columbia (flag of British Columbia on the background and the coat of arms of British Columbia on the right, front side)
can.drvlic.mb.type1;Canadian Driving License - Manitoba (a bull above the personal photo, front side)
can.drvlic.nb.type1;Canadian Driving License - New Brunswick (flower on the background, front)
can.drvlic.nb.type2;Canadian Driving License - New Brunswick (watermark in the form of a leaf, front)
can.drvlic.nl.type1;Canadian Driving License - Newfoundland and Labrador (a flower on the background on the right, front side)
can.drvlic.nl.type2;Canadian Driving License - Newfoundland and Labrador (a flower on the background on the right, front side)
can.drvlic.ns.type1;Canadian Driving License - Nova Scotia (the escutcheon of Nova Scotia in the top-right corner, front side)
can.drvlic.ns.type2;Canadian Driving License - Nova Scotia (national flag of Canada in the bottom-right corner and a road on the background, front side)
can.drvlic.ns.type3;Canadian Driving License - Nova Scotia (the escutcheon of Nova Scotia in the top-right corner, front side)
can.drvlic.nt.type1;Canadian Driving License - Northwest Territories (a bear on the top-left and top-right corner, front side)
can.drvlic.nu.type1;Canadian Driving License - Nunavut (flag of Nunavut on the top near the name of document, front side)
can.drvlic.on.type1;Canadian Driving License (the flower on the background and sign of ON in the top-right corner, front side)
can.drvlic.on.type2;Canadian Driving License (inscription Canada in the down- right corner, front side)
can.drvlic.pe.type1;Canadian Driving License - Prince Edward Island (the escutcheon of Prince Edward Island in the top-right corner, front side)
can.drvlic.pe.type2;Canadian Driving License - Prince Edward Island (wind farms on the background, front side)
can.drvlic.qc.type1;Canadian Driving License - Quebec (the flag of Quebec above the personal photo on the left, front side)
can.drvlic.sk.type1;Canadian Driving License - Saskatchewan (flower in the top- right corner, front)
can.drvlic.type1;Canadian Driving License (globe on the background, front)
can.drvlic.yt.type1;Canadian Driving License - Youkon (the coat of arms of Youkon and a small personal photo on the right, front side)
can.health_insurance.on.type1;Canadian Health Insurance - Ontario (a flower on the background, front side)
can.id.ab.type1;Canadian ID Card - Alberta (flower on the background, front)
can.id.bc.type1;Canadian ID Card - British Columbia (whale on the background, front)
can.id.mb.type1;Canadian ID Card - Manitoba (a bull above the personal photo and CAN sign in the top-right corner, front side)
can.id.nb.type1;Canadian ID Card - New Brunswick (flowers onthe background, front)
can.id.ns.type1;Canadian ID Card - Nova Scotia (a personal photo on the right and a small personal photo in the bottom-left corner, front side)
can.id.ns.type2;Canadian ID Card - Nova Scotia (personal photo on the right and a small personal photo in the middle below, maple leaf in the background, front side)
can.id.nt.type1;Canadian ID Card - Northwest Territories (a vertical card, a bear on the top-left and top-right corner, front side)
can.id.on.type1;Canadian ID Card - Ontario (the flower on the background and sign of ON in the top-right corner, front side)
can.id.pe.type1;Canadian ID Card - Prince Edward Island (emblem of Prince Edward Island in the top-right corner, front)
can.id.qc.type1;Canadian IC Card - Quebec (sun in the top-left corner, front)
can.id.sk.type1;Canadian ID Card - Saskatchewan (forest on the background, front)
can.id.yt.type1;Canadian ID Card - Youkon (the coat of arms of Youkon and a small personal photo on the left, front side)
can.passport.type1;Canadian Passport (Canadian national symbols in the top- right corner, main page)
can.passport.type2;Canadian Passport (biometric symbol in the top-right corner and Canadian coat of arms on the background, main page)
can.rp.type1;Canadian Residence Permit (ducks on the background and stamp with duck in the down-right corner, front)
can.rp.type2;Canadian Residence Permit (the contour of Canada on the top, front)
can.visa.type1;Canadian Visa (maple leaves on the background, main page)
card.embossed;
card.freeform;
card.indent;
che.drvlic.type1;Swiss Driving License (swiss flag in the top-left corner, CH sign in the top-right corner, front side)
che.id.type1;Swiss ID Card (swiss flag in the top-left corner, stamp with cross in the top-right corner, front side)
che.passport.type1;Swiss Passport (red rectangle in the top-right corner, main page)
che.rp.type1;Swiss Residence Permit (CHE sign in the top-left corner and swiss coat of arms on the right, front side)
che.visa.type1;Swiss Visa (CHE sign in the top-right corner)
chl.drvlic.type1;Chilean driver licence (photo on the left)
chl.id.type1;Chilean ID card (stamp with star in the top-left corner and eagle on the background, front side)
chl.passport.type1;Chilean Passport (biometric symbol in the bottom-right corner and Chilean coat of arms on the background, main page)
chl.passport.type2;Chilean Passport, main page
chn.drvlic.type1;Driving License of the People's Republic of China (owner photo in the lower right corner, front side)
chn.homereturn.type1;Chinese Home Return Card (the great Wall of China on the backgronud, front)
chn.id.type1;Chinese ID Card (Chinese emblem in the top-left corner, front)
chn.passport.type1;Chinese Passport (China from the bottom in the background and barcode on the left, main page)
chn.passport.type2;Chinese Passport (green lotus on the left, main page)
chn.passport.type3;Chinese Passport (biometric symbol in the top-right corner and a flower on the background, main page)
chn.passport.type4;Chinese Passport (biometric symbol in the top-right corner and CHN sign on the right, main page)
chn.passport.type5;Chinese Passport (biometric symbol in the top-left corner, main page)
civ.drvlic.type1;Driving License of of Côte d'Ivoire(the coat of arms in the top-left corner, front side)
civ.id.type1;Côte d'Ivoire ID card (the contour of Côte d'Ivoire and emblem in the right area)
civ.passport.type1;Passport of Côte d'Ivoire (the contour of Côte d'Ivoire in the bottom-right corner of photo, main page)
cmr.drvlic.type1;Drvier Licence of Cameroon (photo of the owner on the front side on left)
cmr.id.type1;Identification Card of Cameroon (photo of the owner on the background, front side)
cmr.id.type2;Identification Card of Cameroon (emblem of country on the background, front side)
cmr.passport.type1;Passport of Cameroon (biometric symbol in the top-left corner, main page)
cmr.passport.type2;Passport of Cameroon (RC sign in the top-right corner of photo, main page)
cod.drvlic.type1;Driving License of Democratic Republic of Congo (emblem with a lion on the background, front side)
cod.id.type1;
cod.passport.type1;Passport of Democratic Republic of Congo (the coat of arms of the Democratic Republic of the Congo on the background, main page)
cod.passport.type2;Passport of Democratic Republic of Congo (the coat of arms of the Democratic Republic of the Congo on the background, main page)
cog.drvlic.type1;Driving License of Republic of the Congo (a flag of of Republic of the Congo on the right, front side)
cog.id.type1;ID Card of Republic of the Congo (a coat of arms on the right side, front)
cog.passport.type1;Congo passport - Congo emblem on the background, main
cog.passport.type2;Congo passport (photo of the owner on the background, main page)
col.drvlic.type1;Colombian Driving License (the coat of arms of Colombia in the top-left corner, front side)
col.id.type1;Colombian ID Card (Colombian emblem on the background, front side)
col.passport.type1;Colombian Passport (a small personal photo in the top-right corner, main page)
col.passport.type2;Colombian Passport (a personal photo on the left, no mrz zone on document, main page)
com.id.type1;Id card of Comoros (Comoros flag on the top middle)
com.passport.type1;Passport of Comoros (barcode in the middle of document, main page)
com.passport.type2;Passport of Comoros (Comoros coat of arms on the background, main page)
cpv.drvlic.type1;Driver's license of Cape Verde (coat of arms over the photo of the owner, front side)
cpv.id.type1;Cabo Verde ID Card
cpv.id.type2;Cabo Verde ID Card (national symbols in left area, front)
