Document type;Document description
kir.passport.type1;Passport of Republic of Kiribati (a personal photo on the background, main page)
kna.drvlic.type1;Driving License of Saint Kitts and Nevis (the national flag in the top-right corner and a countour of country on the background, front side)
kna.passport.type1;Passport of Saint Kitts and Nevis (biometric symbol in the top-right corner, main page)
kna.passport.type2;Passport of Saint Kitts and Nevis (barcode above the mrz zone, main page)
kor.drvlic.type1;Korean driver license card - a horizontal card, part of emblem on the background, front
kor.id.type1;Korean ID card - a horizontal card, part of emblem on the top left, globe below, front
kor.passport.type1;Korean passport - circle at the center, main
kor.passport.type2;Korean passport - emblems on the background, main
kwt.drvlic.type1;Driving License of Kuwait (the coat of arms of Kuwait in the top-right corner, front side)
kwt.id.type1;ID card of Kuwait (static fields in one language on both side, front side)
kwt.id.type2;ID card of Kuwait (static fields in one language on one side, front side)
kwt.passport.type1;Passport of Kuwait (the coat of arms of Kuwait in the middle on the background, main page)
kwt.passport.type2;Passport of Kuwait (small Kuwait's sign on the middle top)
lao.passport.type1;Passport of Lao People's Democratic Republic (biometric symbol in the top-left corner, main page)
lbn.passport.type1;Lebanese passport (the coat of arms of Lebanon in the top right corner, main page)
lbn.passport.type2;Lebanese passport (the coat of arms of Lebanon in the top right corner, main page)
lbn.passport.type3;Lebanese passport (travel document for palestinian refugees, main page)
lbn.passport.type4;Lebanese passport (service passport, photo on the left, signature on the bottom right)
lbr.passport.type1;Liberian Passport (a personal photo and Liberian coat of arms on the background, main page)
lbr.passport.type2;Liberian Passport (a personal photo and Liberian coat of arms on the background, main page)
lbr.passport.type3;Liberian Passport (a personal photo and Liberian coat of arms on the background, main page)
lby.passport.type1;Libyan Passport (emblem of Libya on the background, main page)
lca.id.type1;ID of Saint Lucia (barcode on the middle, main page)
lca.passport.type1;Passport of Saint Lucia (barcode on the middle, main page)
lca.passport.type2;Passport of Saint Lucia
lie.drvlic.type1;Driving license of Liechtenstein (emblem of Liechtenstein in the top-right corner, front)
lie.id.type1;ID Card of Liechtenstein (flag of Liechtenstein in the top- left corner, front)
lie.id.type2;ID Card of Liechtenstein (crown stamp on the top, front)
lie.passport.type1;Passport of Liechtenstein (emblem of Liechtenstein in the bottom on the photo, main page)
lka.drvlic.type1;Driving Licence of Sri Lanka (a personal photo on the left side, purple letters SL on the right side, front page)
lka.id.type1;National Identity Card of Sri Lanka (a personal photo on the left side, lotus on the top-right side, front page)
lka.passport.type1;Passport of Sri Lanka (a personal photo in the middle on the background, main page)
lso.passport.type1;Passport of Lestho (coat of arms of Lesotho in the right-top corner of photo and flowers on the background, main page)
lso.passport.type2;Passport of Lestho (coat of arms of Lesotho and biometric symbol in the right-top corner, main page)
ltu.drvlic.type1;Lithuanian Passport (a small personal photo in the bottom- right corner, main page)
ltu.drvlic.type2;Lithuanian Passport (cars in the bottom-right corner, main page)
ltu.id.type1;Lithuanian ID card (biometric symbol in the top-left corner and chip on the left, front side)
ltu.id.type2;Lithuanian ID card (star watermark on the background, front side)
ltu.passport.type1;Lithuanian Passport (biometric symbol above the personal photo, main page)
ltu.passport.type2;Lithuanian Passport (circle stamp in the top-right corner, main page)
ltu.passport.type3;Lithuanian Passport (the coat of arms of Lithuania in the middle on the background, main page)
ltu.rp.type1;Lithuanian Residence Permit (a bull above the personal photo and the coat of arms of Lithuania on the right, front side)
ltu.visa.type1;Lithuanian Visa (LTU sign in the top-right corner, main page)
lux.drvlic.type1;Luxembourg driver's license (flag in the upper left corner and text PERMIS DE CONDUIRE at the middle, front side)
lux.id.type1;ID Card of Luxembourg (biometric symbol in the top-left corner, front)
lux.id.type2;ID Card of Luxembourg (the contour of Luxembourg in the top- right corner, front, new type)
lux.id.type3;ID Card of Luxembourg (number field on the bottom, front)
lux.passport.type1;Passport of Luxembourg (line on the background, main page)
lux.passport.type2;Passport of Luxembourg (tiger on the background, main page)
lux.rp.type1;Residence Permit of Luxembourg (the contour of Luxembourg in the top-left corner, front)
lux.rp.type2;Residence Permit of Luxembourg (biometric symbol in the top- left corner, front)
lux.rp.type3;Residence Permit of Luxembourg (bull with stars on the middle, front)
lux.visa.type1;Visa of Luxembourg (LUX sign in the top-right corner, front)
lva.drvlic.type1;Latvian Passport (a small personal photo and LV letters in the bottom-right corner, main page)
lva.drvlic.type2;Latvian Passport (a personal photo in the middle on the background, main page)
lva.id.type1;Latvian ID card (the coat of arms of Latvia in the top-right corner, front side)
lva.id.type2;Latvian ID card (the coat of arms of Latvia in the top-right corner, front side)
lva.passport.type1;Latvian Passport (a tracery on the right, main page)
lva.passport.type2;Latvian Passport (a goose in the top-right corner, main page)
lva.passport.type3;Latvian Passport (diplomatic document, main page)
lva.passport.type4;Latvian Passport (page passport, main page)
lva.rp.type1;Latvian Residence Permit (a bull above the personal photo and the coat of arms of Latvia on the right, front side)
mar.id.type1;Morocco ID card (border in the head, emblem in the center, front)
mar.passport.type1;Passport of Morocco (stamp with the coat of arms of Morocco in the top-right corner, main page)
mco.id.type1;ID Card of Monaco (chip on the left, front)
mco.passport.type1;Passport of Monaco (emblem of Monaco in the right on the photo, main page)
mco.rp.type1;Residence Permit of Monaco (red line in the top-right corner, front)
mda.drvlic.type1;Driving License of Republic of Moldova (flag of Republic of Moldova in the top-left corner, front)
mda.drvlic.type2;Driving License of Republic of Moldova (emblem of Republic of Moldova in the top-right corner, front)
mda.drvlic.type3;Driving License of Republic of Moldova (the national coat of arms on the background, front)
mda.id.type1;ID Card of Republic of Moldova (emblem of Republic of Moldova on the background, front)
mda.id.type2;ID Card of Republic of Moldova (blue stamp with emblem of Republic of Moldova in the left and pink background, front)
mda.id.type3;ID Card of Republic of Moldova (biometric symbol in the top- right corner, front)
mda.passport.type1;Passport of Republic of Moldova (biometric symbol in the top-left corner, main page)
mda.passport.type2;Passport of Republic of Moldova (vertical field nationality on the right, main page)
mdg.passport.type1;Passport of Madagascar (the seal of Madagascar on the background, main page)
mdg.passport.type2;Passport of Madagascar (tree on the background, main page)
mdv.passport.type1;Passport of Maldives (people on the background, main page)
mdv.passport.type2;Passport of Maldives (watermark of seashells on the right, main page)
mex.drvlic.ag.type1;Mexican Driving License (Emblem on the upper left corner, front)
mex.drvlic.bc.type1;Mexican Driving License (Emblem on the upper left corner and outline of state Baja California at the background, front)
mex.drvlic.bc.type2;Mexican Driving License (Emblem of the Baja California state on the upper right corner and on the background, front)
mex.drvlic.bc.type3;Mexican Driving License (Emblem of the Baja California state on the upper right corner and on the background, front)
mex.drvlic.bc.type4;Mexican Driving License (Emblem of the Baja California state on the upper right corner, vertical type)
mex.drvlic.bs.type1;Mexican Driving License (Emblem of the Baja California state on the upper right corner and on the background, front)
mex.drvlic.ch.type1;Mexican Driving License (Name and outline of state Chihuahua at the top left, front)
mex.drvlic.ch.type2;Mexican Driving License (Coat of arms of Chihuahua on the right side, front)
mex.drvlic.cl.type1;Mexican Driving License (Name and outline of state Chihuahua at the top left, front)
mex.drvlic.cm.type1;Mexican Driving License (Name and outline of state Chihuahua at the top left, front)
mex.drvlic.cm.type2;Mexican Driving License (Name and outline of state Chihuahua at the top left, front)
mex.drvlic.co.type1;Mexican Driving License (Text A and Licencia de conducir on the upper left corner and text Gobierno de Coahuila and Un Estado Energia next, front)
mex.drvlic.co.type2;Mexican Driving License (Text Licencia Federal at the top, front)
mex.drvlic.co.type3;Mexican Driving License (Text A and Licencia de conducir on the upper left corner and text Gobierno de Coahuila and Un Estado Energia next, front)
mex.drvlic.df.type1;Mexican Driving License (Emblem with castle and lions and text Estados Unidos Mexicanos at the top, front)
mex.drvlic.df.type2;Mexican Driving License (Circle and text Estados Unidos Mexicanos etc next, front)
mex.drvlic.df.type3;Mexican Driving License (Circle and text Estados Unidos Mexicanos etc next, front)
mex.drvlic.df.type4;Mexican Driving License (Circle and text Estados Unidos Mexicanos etc next, front)
mex.drvlic.df.type5;Mexican Driving License (Circle and text Estados Unidos Mexicanos etc next, front)
mex.drvlic.df.type6;Mexican Driving License (Emblem with castle and lions and text Estados Unidos Mexicanos at the top, front)
mex.drvlic.df.type7;Mexican Driving License (Circle and text Estados Unidos Mexicanos etc next, front)
mex.drvlic.em.type1;Mexican Driving License (Emblem with castle and lions and text Estados Unidos Mexicanos at the top, front)
mex.drvlic.em.type2;Mexican Driving License (Emblem on the upper left corner and pyramid at the background, front)
mex.drvlic.em.type3;Mexican Driving License (Emblem of the Baja California state on the upper right corner and on the background, front)
mex.drvlic.gr.type1;Mexican Driving License (Probably issue year on a background, front)
mex.drvlic.gr.type2;Mexican Driving License (Flag with emblem on the upper left corner, front)
mex.drvlic.gr.type3;Mexican Driving License (Flag with emblem on the upper left corner, front)
mex.drvlic.gr.type4;Mexican Driving License (a vertical card)
mex.drvlic.gr.type5;Mexican Driving License (a coat of arms on the upper left corner, front)
mex.drvlic.gr.type6;Mexican Driving License (a pattern on the left side, front)
mex.drvlic.gt.type1;Mexican Driving License (Emblem with castle and lions and text Estados Unidos Mexicanos at the top, front)
mex.drvlic.hg.type1;Mexican Driving License (Emblem with flags on the upper left corner and text Licencia Para Conducir under it, front)
mex.drvlic.hg.type2;Mexican Driving License (Emblem with flags on the upper left corner and text Licencia Para Conducir under it, front)
mex.drvlic.ja.type1;Mexican Driving License (Jalisko on the upper left corner and emblem next, front)
mex.drvlic.ja.type2;Mexican Driving License (Jalisko on the upper left corner and emblem next, front)
mex.drvlic.mo.type1;Mexican Driving License (White wide strip with text at the top and rainbow strip at the down, front)
mex.drvlic.nl.type1;Mexican Driving License (Flag with emblen on the upper left corner and text Nuevo Leon next, front)
mex.drvlic.nl.type2;Mexican Driving License (Green drvlic and text Nuevo Leon Unido at the upper left corner, front)
mex.drvlic.pu.type1;Mexican Driving License (Puebla and quatrefoil on the upper left corner and text next and pattern under the text, front)
mex.drvlic.pu.type2;Mexican Driving License (Text Puebla Sigue and circle at the lefr upper corner and text Estados Unidos Mexicanos, front)
mex.drvlic.pu.type3;Mexican Driving License (Puebla and quatrefoil on the upper left corner and text next and pattern under the text, front)
mex.drvlic.pu.type4;Mexican Driving License (Text Puebla Sigue and circle at the lefr upper corner and text Estados Unidos Mexicanos, front)
mex.drvlic.qr.type1;Mexican Driving License (Quintana Roo emblem on the top right and a flower on the background , front)
mex.drvlic.qr.type2;Mexican Driving License (Text Estados Unidos Mexicanos telum between two emblem, front)
mex.drvlic.qt.type1;Mexican Driving License (at the top right is the eight- pointed symbol and at the bottom is a set of circles, front)
mex.drvlic.si.type1;Mexican Driving License (Sinaloa name and emblem on the top left, front)
mex.drvlic.si.type2;Mexican Driving License (Sinaloa emblem on the top left and photo on the right, front)
mex.drvlic.si.type3;Mexican Driving License (Sinaloa emblem on the top left and photo on the left, front)
mex.drvlic.si.type4;Mexican Driving License (Sinaloa emblem on the top left and photo on the left, front)
mex.drvlic.so.type1;Mexican Driving License (Sonora emblem on the top left and on the background, front)
mex.drvlic.so.type2;Mexican Driving License (Text Sonora at the middle and red left upper corner, front)
mex.drvlic.tb.type1;Mexican Driving License (Text Estados Unidos Mexicanos at the lefr upper corner and emblem next and symbol T, front)
mex.drvlic.ve.type1;Mexican Driving License (Emblem on the upper left corner and outline of state Baja California at the background, front)
mex.drvlic.ve.type2;Mexican Driving License (Emblem on the upper left corner, front)
mex.drvlic.ve.type3;Mexican Driving License (Emblem on the upper left corner, front)
mex.drvlic.yu.type1;Mexican Driving License (Yucatan emblem on the top right and a building at the background, front)
mex.drvlic.za.type1;Mexican Driving License (Statue of a man on a horse on the background, front)
mex.drvlic.za.type2;Mexican Driving License (a coat of arms in the top-left corner, front)
mex.drvlic.za.type3;Mexican Driving License (a countour of Mexica near the small personal photo in the bottom-right corner, front)
mex.id.type1;Mexican ID Card (Mexican emblem in the top-left corner and MEXICO-descriprion on the top, front)
mex.id.type2;Mexican ID Card (Mexican emblem in the top-left corner and a copy of personal photo on the right, front)
mex.id.type3;Mexican ID Card (Mexican emblem in the top-left corner, front)
mex.id.type4;Mexican ID Card (Text Mexico at the middle top and green and red stripes under it, front)
mex.passport.type1;Mexican Passport (barcode on the middle, main page)
mex.passport.type2;Mexican Passport (barcode on the middle, main page)
mex.passport.type3;Mexican Passport (round stamp in the top-right corner on the photo, main page)
mex.visa.type1;Mexican visa (Mexican emblem in the upper left corner and a watermark diagonally, front)
mkd.drvlic.type1;Macedonian Driving License (MKD sign in the top-left corner and the national emblem of Macedonia in the top-right corner, front side)
mkd.id.type1;Macedonian ID card (name of document in the top is written on two languages, front side)
mkd.id.type2;Macedonian ID card (ename of document in the top is written on three languages, front side)
mkd.passport.type1;Macedonian Passport (the tracery in the top-right corner, main page)
mkd.passport.type2;Macedonian Passport (biometric symbol above the photo and a small personal photo in the top-right corner, main page)
mli.passport.type1;Passport of the Republic of Mali (the coats of arms of the Republic of Mali on the background, main page)
mli.passport.type2;Passport of the Republic of Mali (barcode above the mrz zone, main page)
mli.passport.type3;Passport of the Republic of Mali (barcode above the mrz zone, main page)
mlt.drvlic.type1;Maltese Driving Lisence(the counter of country in the bottom-left corner)
mlt.drvlic.type2;Maltese Driving Lisence(the counter of country in the bottom-left corner)
mlt.id.type1;Maltese ID Card (a cross in the top-left corner, front side)
mlt.id.type2;Maltese ID Card (Maltese coat of arms in the top-right corner, front side)
mlt.passport.type1;Maltese Passport (a small copy of personal photo in the centre, main page)
mlt.passport.type2;Maltese Passport (a copy of personal photo on the right, main page)
mlt.rp.type1;Maltese Residence Permit (Maltese coat of arms in the top- right corner and MT sign in the top-left corner, front side)
mlt.rp.type2;Maltese Residence Permit (emblem of country in right area, front)
mlt.visa.type1;Maltese Visa (MLT sign in the top-right corner)
mmr.passport.type1;Passport of the Republic of the Union of Myanmar (a personal photo in the left on the background, main page)
mmr.passport.type2;Passport of the Republic of the Union of Myanmar (traveling document, a personal photo in the left on the background, main page)
mne.drvlic.type1;Driving License of Montenegro (the coat of arms of Montenegro in the top-left corner, front side)
mne.id.type1;ID card of Montenegro (the contour of Montenegro and MNE sign in the top-right corner, front side)
mne.passport.type1;Passport of Montenegro (the coat of arms of Montenegro and biometric symbol above the personal photo, main page)
mng.drvlic.type1;Mongolian Driving License (mongolian emblem on the background, front side)
mng.id.type1;Mongolian id card (the coat of arms in the upper left corner, the map in the lower right, the flag against the background, front side)
mng.passport.type1;Mongolian Passport (the symbol of Mongolia in the middle on the background, main page)
mng.passport.type2;Mongolian Passport (the symbol of Mongolia and copy of main photo in the middle on the background, main page)
moz.passport.type1;Passport of the Republic of Mozambique (barcode above the mrz zone, main page)
moz.passport.type2;Passport of the Republic of Mozambique (biometric symbol in the top-left corner, main page)
mrt.passport.type1;Mauritanian Passport (the contour of Mauritania in the middle on the top and the coat of arms of Mauritania in the middle on the background, main page)
mrz;
msr.passport.type1;Passport of Montserrat (watermark on the personal photo, main page)
mus.passport.type1;Passport of the Republic of Mauritius (the coat of arms of Mauritius in the middle on the background, main page)
mwi.passport.type1;Malawian Passport (Malawian coat of arms on the right and stamp with a bird in the top-left corner, main page)
mys.id.type1;Malaysian ID Card (Malaysian flag in the top-right corner and a chip on the left, main page)
mys.passport.type1;Malaysian Passport (Malaysian coat of arms on the background and a stamp with a tiger in the middle, main page)
mys.passport.type2;Malaysian Passport (a flower on the background (ordinary document), main page)
mys.passport.type3;Malaysian Passport (a small personal photo in the bottom- right corner and a flower in the centre, main page)
nam.passport.type1;Passport of Republic of Namibia (the coat of arms of Namibia in the bottom-right corner of photo and in the middle on the background, main page)
ner.passport.type1;Republica de Niger Passport (photo on the left, signature on the bottom)
nga.drvlic.type1;Driver License of the Federal Republic of Nigeria (small photo of the owner in the lower right corner, front page)
nga.drvlic.type2;Driver License of the Federal Republic of Nigeria (the coat of arms of Nigeria on the background, front page)
nga.id.type1;ID card of the Federal Republic of Nigeria (emblem of Azerbaijan in the top-left corner, front side)
nga.passport.type1;Passport of the Federal Republic of Nigeria (the coat of arms of Nigeria in the middle on the background, main page)
nga.passport.type2;Passport of the Federal Republic of Nigeria (vertical inscription of country name on the right side of photo and lines on the background, main page)
nga.passport.type3;Passport of the Federal Republic of Nigeria (image of the borders of the country in the upper right corner, main page)
nic.passport.type1;Passport of the Republic of Nicaragua (a toucan in the top- right corner, main page)
nic.passport.type2;Passport of the Republic of Nicaragua (a flower and the personal photo on the background, main page)
nic.passport.type3;Passport of the Republic of Nicaragua (watermarks with the country name on the background, main page)
nld.drvlic.type1;NLD Driving License (one big and two small circle on the background, horizontal card, front)
nld.drvlic.type2;Driving License of Netherlands (barcode in the bottom-right corner, front side)
nld.drvlic.type3;Driving License of Netherlands (circles on the background, front side)
nld.id.type1;ID Card of Netherlands ()
nld.id.type2;ID card of Netherlands (biomentric symbol on the bottom, front side)
nld.passport.type1;Passport of Netherlands (a small personal photo on the right, main page)
nld.passport.type2;Passport of Netherlands (checkered background and a personal number field on the right, main page)
nld.passport.type3;Passport of Netherlands (a small personal photo on the right, main page)
nld.rp.type1;Residence Permit of Netherlands (the coat of arms of the Netherlands on the left and a bull above the personal photo, front side)
nld.visa.type1;Visa of Netherlands (NLD sign in the top-right corner, main page)
nor.drvlic.type1;Norwegian Driving License (ninth poin under the photo and a watermark with Norwegian coat of arms to the right of the photo, front side)
nor.drvlic.type2;Norwegian Driving License (N sign in the top-left corner and ninth poin under the signature, main page)
nor.id.type1;Norwegian ID Card (a chip on the left and Norwegian coat of arms on the top, front side)
nor.passport.type1;Norwegian Passport (a stamp with letters NOR in the top- right corner and a small personal photo in the centre, main page)
nor.rp.type1;Norwegian Residence Permit (biometric symbol in the top-left corner and Norwegian coat of arms on the right, front side)
nor.visa.type1;Norwegian Visa (NOR sign in the top-right corner)
npl.passport.type1;Nepalese Passport (a small personal photo on the right side, main page)
nru.passport.type1;Passport of the Republic of Nauru (flag of Nauru above the personal photo, main page)
nzl.drvlic.type1;Driving License of New Zealand (flag of New Zealand above the personal photo, front side)
nzl.drvlic.type2;Driving License of New Zealand (flag of New Zealand above the personal photo, front side)
nzl.id.type1;Identity card of New Zealand (flag of New Zealand above the personal photo, front side)
nzl.id.type2;Identity card of New Zealand (flag of New Zealand above the personal photo, front side)
nzl.id.type3;Identity card of New Zealand (flag of New Zealand above the personal photo, front side)
nzl.id.type4;Identity card of New Zealand (biometric symbol in the top- right corner, main page)
nzl.passport.type1;Passport of New Zealand (a tracery above the mrz zone, main page)
nzl.passport.type2;Passport of New Zealand (biometric symbol in the top-right corner, main page)
nzl.passport.type3;Passport of New Zealand (NZ sign in the top-right corner, main page)
omn.drvlic.type1;Omani Drviver License (national coat of arms in the top- right corner and a round symbol in the left, front)
omn.drvlic.type2;Omani Driver License (national coat of arms in the top-right corner and copy of a personal photo in the centre, front)
omn.id.type1;Omani ID Card (national coat of arms in the top-right corner, front)
omn.id.type2;Omani ID Card (national coat of arms in the top-right corner and copy of a personal photo in the centre, front)
omn.passport.type1;Omani Passport (biometric symbol in the top-right corner and stamp with the national emblem of Oman in the top-right corner of photo, main page)
omn.passport.type2;Omani Passport (biometric symbol in the top-right corner and stamp with the national emblem of Oman in the top-right corner of photo, main page)
pak.drvlic.type1;Pakistani Driving License (the national flag in the top- right corner and a personal photo on the left, front side)
pak.drvlic.type2;Pakistani Driving License (the national flag in the top-left corner, front side)
pak.drvlic.type3;Pakistani Driving License (the police emblem in the top- right corner, front side)
pak.id.type1;Pakistani ID Card (the national flag in the top-right corner and the national coat of arms in the top-left corner, front side)
pak.id.type2;Pakistani ID Card (the national coat of arms in the top- right corner, front side)
pak.passport.type1;Pakistani Passport (barcode abobe the mrz zone, main page)
pan.passport.type1;Panamanian Passport (barcode abobe the mrz zone, main page)
pan.passport.type2;Panamanian Passport (the coat of arms of Panama on the background, main page)
pan.passport.type3;Panamanian Passport (the coat of arms of Panama in the left corner and Red outline of a country map in the middle, main page)
per.drvlic.type1;Peruvian driver licence
per.id.type1;Peru ID Card (blue background with white wavy lines, front)
per.id.type2;Peru ID Card (white backgroung, silhouette of mountain, emblem of country in right_upper connor, front)
per.id.type3;Peru ID Card (white backgroung, silhouette of mountain, emblem of country in right_upper connor, front)
per.migration_card.type1;Peruvian Migration Card
per.passport.type1;Peruvian Passport (a small personal photo and watermark with Peruvian coat of arms on the right, main page)
per.passport.type2;Peruvian Passport (barcode above the mrz zone and a small personal photo on the right, main page)
per.passport.type3;Peruvian Passport (inscription of document name in two languages above the photo, main page)
phl.drvlic.type1;Philippine Driving License (a sign of the land transportation office in the right-top corner and on the background, front side)
