Document type;Document description
cpv.passport.type1;Passport of Cape Verde (the coat of Arms of Cape Verde on the background, main page)
cpv.passport.type2;Passport of Cape Verde (the coat of Arms of Cape Verde on the background, main page)
cri.id.type1;
cri.id.type2;
cri.passport.type1;Passport of Costa Rica (barcode in the middle of document, butterfly in the bottom-right corner of photo, main page)
crop;
cub.drvlic.type1;Driving License of Cuba(red coat of arms on the background and holographic stamp to the right of photo)
cub.drvlic.type2;Driving License of Cuba(inscription CUBA on the background and blue stamp with car)
cub.drvlic.type3;Driving License of Cuba(inscription CUBA on the background and blue stamp with car)
cub.id.type1;Cuban ID card (the coat of arms of Cuba on the top middle and flag of Cuba on the top left conner, front side, three- line mrz zone on the bottom and QR code, back side)
cub.passport.type1;Passport of Cuba (rhombuses on the background, main page)
cub.passport.type2;Passport of Cuba (barcode above the mrz zone, main page)
cym.passport.type1;Passport of Cayman Islands
cyp.drvlic.type1;Driver License Card of Cyprus (Cyprus coat of arms and country outline on the background, front side)
cyp.id.type1;ID Card of Cyprus (Cyprus coat of arms on the background, front side)
cyp.id.type2;ID Card of Cyprus (Cyprus coat of arms on the top-left corner and biometric symbol, front side)
cyp.passport.type1;Passport of Cyprus (the countour of Cyprus in the top-left corner, Cyprus coat of arms in the top-left corner, main page)
cyp.passport.type2;Passport of Cyprus (Cyprus coat of arms on the background, main page)
cze.drvlic.type1;Czech Driving license (the sign of the European Union with letter in the top-left corner, front)
cze.drvlic.type2;Czech Driving license (table on the middle,information on left down corner, back)
cze.id.type1;Czech ID Card (CZ sign on the right and rings on the background, front)
cze.id.type2;Czech ID Card (old type, Czechia emblem in the down-left corner, back, stamp in the form of a tree, front)
cze.id.type3;Czech ID Card (Czechia emblem in the down-left corner, back, stamp in the form of a tree, front)
cze.passport.type1;Czech Passport (stamp on the top, main page)
cze.rp.type1;Czech Residence Permit (biometric symbol in the top-left corner and Czech emblem on the right, front)
cze.rp.type2;Czech Residence Permit (patterned frame around the photo, front)
cze.rp.type3;Czech Residence Permit (bull on the middle, front)
cze.visa.type1;Czech Visa (cze sign in the top-right corner, main page)
cze.vrc.type1;Czech Vehicle Registration Certificate (the sign of the European Union with letters CZ in the top-left corner and leaves in the bottom-left corner, front side )
deu.drvlic.type1;German Driving License (sign of the European Union with letter D in the top-left corner and three road signs in the bottom-right corner, front side)
deu.drvlic.type2;German Driving License (sign of the European Union with letter D in the top-left corner and stamp with the silhouette of the letter D in the bottom-right corner, front side)
deu.id.type1;German ID card (the coat of arms of Germany on the background, front side, three-line mrz zone on the bottom, back side)
deu.id.type2;German ID card (the coat of arms of Germany on the background and two-line mrz zone on the bottom, front side)
deu.passport.type1;German Passport (the coat of arms of Germany on the right side, main page)
deu.passport.type2;German Passport (the coat of arms of Germany in the top-left corner and in the middle on the background, main page)
deu.passport.type3;German Passport (stamp with the coat of arms of Germany under the photo, main page)
deu.rp.type1;German Residence Permit (biometric symbol in the top-left corner and a bull above the photo, front side)
deu.visa.type1;German Visa (D sign in the top-right corner, main page)
deu.vrc.type1;
dji.id.type1;Djibouti ID Card (green line under country's name, front)
dji.passport.type1;Passport of Djibouti (the coat of arms of Djibouti and a personal photo on the background, main page)
dma.drvlic.type1;Driver license of Dominica (blue and red wavy lines)
dma.id.type1;Driver license of Dominica (blue and red wavy lines)
dma.passport.type1;Passport of Dominica (the coat of arms of Dominica on the background and a dolphin in the top-right corner, main page)
dnk.drvlic.type1;Danish Driving License (Danish coat of arms on the background, front side)
dnk.drvlic.type2;Danish Driving License (two swans in the right-bottom corner, front side)
dnk.id.type1;Danish ID Card (yellow background, front)
dnk.id.type2;Danish ID Card (5 arrow in right area, ligth stripes in background, front)
dnk.passport.type1;Danish Passport (a small personal photo in the top-right corner)
dnk.rp.type1;Danish Residence Permit (biometric symbol on the top and Danish coat of arms on the right, front side)
dnk.visa.type1;Danish Visa (DNK sign in the top-right corner)
dom.drvlic.type1;Dominican driving license (flag colors in the background, front side)
dom.drvlic.type2;Dominican driving license (coat of arms in the upper right corner, hand with a voting sheet in the lower left corner, front side)
dom.drvlic.type3;Dominican driving license (the coat of arms in the upper left corner, the map in the lower right, the flag against the background, front side)
dom.id.type1;Dominican ID Card (emblem of country in left-upper connor, border of country in right-down connor front)
dom.passport.type1;Passport of Dominican Republic (country name in the top-left corner and barcode above the mrz zone, main page)
dom.passport.type2;Passport of Dominican Republic (country name on the top in the middle, main page)
dom.rp.type1;Dominican Residence Permission (emblem of country in left- upper connor, front)
dza.drvlic.type1;Algerian Driving License (DZ sign in the top-left corner, front side)
dza.id.type1;Algerian ID Card (crescent is on the top-left corner and biometric sign is on the top-right corner)
dza.passport.type1;Algerian Passport (the contour of the country on the right and sun in the bottom-right of the photo, main page)
ecu.id.type1;
ecu.id.type2;
ecu.passport.type1;Ecuadorian Passport (turtle in the top-right corner, main page)
egy.id.type1;Egyptian ID card (Egyptian pyramids on the background, front side)
egy.passport.type1;Egyptian Passport (a bird in the top-left corner of photo and barcode under the photo, main page)
egy.passport.type2;Egyptian Passport (a bird in the top-left corner of photo and barcode under the photo, main page)
egy.passport.type3;Egyptian Passport (patterns in the upper corners, main page)
eri.passport.type1;Passport of Eritrea (a personal photo in the middle on the background, main page)
esp.drvlic.type1;Spanish Driving Licence (card-size, number field below the photo)
esp.drvlic.type2;Spanish Driving Licence (card-size, number field to the right of the photo)
esp.id.type1;Spanish ID card (card-size, old one, a personal photo on the right and biometric symbol in the top-left corner, front side)
esp.id.type2;Spanish ID card (card-size, new one, a personal photo on the left and chip on the left, front side)
esp.passport.type1;Spanish Passport (new biometric Passport, biometric symbol on the top, main page)
esp.passport.type2;Spanish Passport (old biometric, biometric symbol in the top-left corner and a personal photo on the background, main page)
esp.passport.type3;Spanish Passport (one-line mrz zone on the bottom, main page)
esp.passport.type4;Spanish Diplomatic Biometric Passport
esp.passport.type5;Spanish Passport (not biometric, personal photo on the background, main page)
esp.passport.type6;Spanish Passport (not biometric, personal photo on the background, main page)
esp.rp.type1;Spanish Residence Permit (EU card size, blue-purple)
esp.rp.type2;Spanish Residence Permit (old card size, different colors, large E on the background)
esp.visa.type1;Spanish Visa (ESP sign in the top-right corner, main page)
est.drvlic.type1;Estonian driver license card - a horizontal card, Estonian emblem in the upper left corner, text and stars on the background, front
est.drvlic.type2;Estonian driver license card - a horizontal card, intersecting curved lines on the background, front
est.drvlic.type3;Estonian driver license card - a horizontal card, Estonian flag in the upper left corner, mrz below, front
est.drvlic.type4;Estonian driver license card - a horizontal card, Estonian flag in the upper left corner, text and curved lines on the background, front
est.drvlic.type5;Estonian driver license card - a horizontal card, Estonian flag and photo on the right, front
est.id.type1;Estonian ID card - a horizontal card, Estonian flag in the upper left corner, lion in the upper right, front
est.id.type2;Estonian ID card - a horizontal card, Estonian emblem in the upper left corner, flag on the background, front
est.id.type3;Estonian ID card - a horizontal card, Estonian flag on the top, front
est.passport.type1;Estonian passport - lion on the top right corner of photo, curved lines on the background, main
est.passport.type2;Estonian passport - lion on the top right corner of photo, curved lines on the background, main
est.passport.type3;Estonian passport - lion on the top right corner of photo, curved lines on the background, main
est.passport.type4;Estonian passport - lion on the top right corner of photo, curved lines on the background, main
est.rp.type1;Estonian RP card (bull in left upper connor, pinky-blue background, emlem of Estonia in right area, front)
est.visa.type1;Estonian Visa (EST sign in the top-right corner)
eth.passport.type1;Ethiopian Passport (barcode above the mrz zone, main page)
eu.medcard.type1;EU Medcard
fin.drvlic.type1;Finnish Driving License (number-field under the personal photo, front side)
fin.drvlic.type2;Finnish Driving License (number-field in the right side of the photo, front side)
fin.drvlic.type3;Finnish Driving License (Finnish police badge on background, front side)
fin.drvlic.type4;Finnish Driving License (triangles pattern on background, front side)
fin.drvlic.type5;Finnish Driving License (stamp on the background, front side)
fin.id.type1;Finnish ID card (chip on the left side and a personal photo in the bottom-right corner, front side)
fin.id.type2;Finnish ID card (a personal photo on the left side and stamp with photo in the middle, front side)
fin.passport.type1;Finnish Passport (a star in the middle of page near the stamp with a personal photo, main page)
fin.passport.type2;Finnish Passport (rhombus in the top-right corner, main page)
fin.rp.type1;Finnish ID card (biometric symbol in the top-left corner, front side, a bear in the top-left corner, front side)
fin.visa.type1;Finnish Visa (FIN sign in the top-right corner, main page)
fji.drvlic.type1;Driving License of the Republic of Fiji (the contour of Fiji on the background, front side)
fji.passport.type1;Passport of the Republic of Fiji (ships and a personal photo on the background, main page)
fji.tin.type1;Tax Identification Number of the Republic of Fiji (a leaf in the right top corner, front page)
fra.drvlic.type1;French Driving License (the sign of the European Union with letter in the top-left corner, front)
fra.id.type1;CARTE NATIONALE D'IDENTITÉ
fra.passport.type1;French Passport (RF sign in the photo corner, main page)
fra.passport.type2;French Passport (photo in the middle on the background, main page)
fra.passport.type3;French Passport (photo in the middle on the background, main page)
fra.passport.type4;French Passport (REPUBLIQUEFRANÇAISE above the machine- readable zone and RFs at the corners of the facial image, main page)
fra.passport.type5;French Passport (Marianne head in the top-left corner, main page)
fra.rp.type1;France residence permit card - background: France emblem on the right, bull on the left, front
fra.visa.type1;French Visa (FRA sign in the top-right corner, main page)
gab.id.type1;ID Card of Gabonese Republic (a national flag in the top- left corner and a coat of arms in the top-right corner, front
gab.passport.type1;Passport of Gabon (barcode above the mrz zone, main page)
gab.passport.type2;Passport of Gabon (watermark on upper right corner, main page)
gbd.passport.type1;Cayman Islands Passport (lines in the form of semicircles on the background, main page)
gbr.drvlic.provisional.type1;British Provisional Driver License (line of text Provisional on the top, front)
gbr.drvlic.provisional.type2;British Provisional Driver License (rubber stamp on the right, front)
gbr.drvlic.provisional.type3;British Provisional Driver License (round stamp on the left, front)
gbr.drvlic.type1;British Driver License (line of text on the top, front)
gbr.drvlic.type2;British Driver License (British flag on the right, front)
gbr.drvlic.type3;British Driver License (round stamp on the left, front)
gbr.passport.type1;British Passport (bird on the background, main page)
gbr.passport.type2;British Passport (compass in the top-left corner, main page)
gbr.passport.type3;British Passport (Photo of the owner on the background, main page)
gbr.passport.type4;British Passport (circles on the background, main page)
gbr.rp.type1;Residence permit (card-size, bull in the top-left corner)
gbr.visa.type1;British Visa (GBR sign in the top-right corner, main page)
gbr.visa.type2;British Visa (British emblem on the background, main page)
geo.drvlic.type1;Georgian driver license card - a horizontal card, background: flag on top country and outline below, front
geo.drvlic.type2;Georgian driver license card - a horizontal card, flag in the upper left corner, emblem on the background, front
geo.drvlic.type3;Georgian driver license card - a horizontal card, emblem on the background, front
geo.id.type1;Georgian ID card - a horizontal card, country outline in the upper right, dotted lines on the background, front
geo.passport.type1;Georgian passport - country emblem in the upper left, has owner's signature, main
geo.passport.type2;Georgian passport - country emblem in the upper left, has patterns on the corners of the photo, main
geo.passport.type3;Georgian passport - circle with patterns in the center, main
geo.passport.type4;Georgian passport - country emblem in the upper left, has owner's signature, main
geo.vrc.type1;Georgian registration sertificate - a horizontal card, background: flag on top and country outline in center, main
gha.passport.type1;Passport of Ghana (barcode above the mrz zone, main page)
gha.passport.type2;Passport of Ghana (the coat of arms of Ghana on the background, main page)
gib.id.type1;ID card from Gibraltar)
gin.passport.type1;Guinean Passport (Guinean emblem on the background, main page)
gmb.passport.type1;Gambian Passport (photo in the right on the background, main page)
gmb.passport.type2;Gambian Passport (photo in the right on the background, main page)
gnb.passport.type1;Passport of Guinea-Bissau (the coat of arms of Passport of Guinea-Bissau on the background, main page)
gnq.passport.type1;Republica de Guinea Passport (photo on the left, signature on the right)
grc.drvlic.type1;Greek Driving License (the sign of the European Union with letter in the top-left corner, front)
grc.id.type1;Greek ID card (printing technique for the whole document)
grc.id.type2;Greek Police ID card (printing technique for the whole document)
grc.passport.type1;Greek Passport (Greek emblem on the background, main page)
grc.rp.type1;Greek Residence Permit (Greek emblem in the right, front)
grc.visa.type1;Greek Visa (GRC sign in the top-right corner, main page)
grd.drvlic.type1;Grenadian driving license (emblem in right corner)
grd.passport.type1;Passport of Grenada (the coat of arms of Grenada on the background, main page)
gtm.passport.type1;Guatemalan Passports (barcode above the mrz zone, main page)
guy.drvlic.type1;Gayana driving license (emblem in top right and flag in top left)
guy.id.type1;Gayana ID card (country outline on the background)
guy.passport.type1;Passport of Guyana (barcode above the mrz zone and the coat of arms of Gayana on the background, main page)
guy.passport.type2;Passport of Guyana (signature place at right side and the coat of arms of Gayana on the background, main page)
hkg.drvlic.type1;Driving License of Hong Kong (drawing in the form of the letters 'hk' on the background, front side)
hkg.id.type1;ID Card of Hong Kong (stamp with a photo under the chip, front side)
hkg.passport.type1;Passport of Hong Kong (a flower on the background and barcode under the photo, front side)
hkg.passport.type2;Passport of Hong Kong (Tsing Ma bridge on the background, biometric symbol, main page)
hnd.drvlic.type1;Driving License of Honduras (the coat of arms of Honduras in the top-left corner, front side)
hnd.id.type1;ID card of Honduras (fingerprint on the right and barcode on the bottom, front side)
hnd.passport.type1;Passport of Honduras (a humming-bird in the top-right corner and barcode above the mrz zone, main page)
hrv.drvlic.type1;Croatian Driving License (sign of the European Union with letters HR in the top-left corner, front side)
hrv.id.type1;Croatian ID card (stamp with RH on the left and , front side)
hrv.id.type2;Croatian ID card (RH sign in the top-left corner and watermark with the coat of arms of Croatia on the photo, front side)
hrv.passport.type1;Croatian Passport (RH sign on the left, main page)
hrv.passport.type2;Croatian Passport (barcode in the middle of the page)
hrv.rp.type1;Croatian Residence Permit (biometric symbol in the top-left corner and the coat of arms of Croatia on the left, front side)
hrv.visa.type1;Croatian Visa (HRV sign in the top-right corner, main page)
hti.drvlic.type1;Haitian Driving License (a coat of arms of Haiti in the middle, front side)
hti.id.type1;Haitian ID Card(a coat of arms of Haiti in bottom-right corner and a flag in the top-right corner, front side)
hti.passport.type1;Haitian passport (photo on the background, main page)
hun.drvlic.type1;Hungarian Driving License (the sign of the European Union with letter in the top-left corner, front)
hun.id.type1;Hungarian ID Card (Hungarian emblem in the top-left corner, front)
hun.id.type2;Hungarian ID Card (Hungarian emblem in the top-right corner and biometric symbol in the top, front)
hun.passport.type1;Hungarian Passport (stamp in the top-right corner, main page)
hun.passport.type2;Hungarian Passport (stamp in the top-right corner, main page)
hun.rp.type1;Hungarian Residence Permit (stamp on the photo, front)
hun.visa.type1;Hungarian Visa (HUN sign in the top-right corner, main page)
idn.drvlic.type1;Indonesian Driving License (Indonesian national symbol in the top-left corner and fingerprint on the right, front side)
idn.id.type1;Indonesian ID Card (a globe on the background, front side)
idn.passport.type1;Indonesian Passport (Indonesian coat of arms on the background, main page)
idn.passport.type2;Indonesian Passport (Indonesian coat of arms on the background, main page)
ind.aadhaar.type1;Indian aadhaar - square card, flag on the top center, emblem on the top left, front
ind.pancard.type1;
ind.pancard.type2;Indian PAN (emblem on the top center, front)
ind.passport.type1;Indian passport - lines on the background, main
irl.drvlic.type1;IRL Driving License (green litter L on the left top corner, horizontal card, front)
irl.drvlic.type2;IRL Driving License (harp on the right, horizontal card, front)
irl.id.type1;Ireland ID Card (Background consists of clovers, front)
irl.passport.type1;Irish Passport (a persoanl photo on the background, main page)
irl.passport.type2;Irish Passport (the coat of arms in the top-right corner, main page)
irl.passport_card.type1;Irish Passport (biometric emblem in the top-right corner, main page)
irn.drvlic.type1;Iranian Driving Licence (the coat of arms in the top-right corner, personal photo on the left, front)
irn.drvlic.type2;Iranian Driving Licence (the coat of arms in the top-right corner, personal photo on the right, front)
irn.passport.type1;Iranian Passport (patterns on the background, main page)
irn.passport.type2;Iranian Passport (photo on the background, main page)
irq.passport.type1;Passport of Iraq (the coat of arms of Iraq on the middle in the top and barcode above the mrz zone, main page)
irq.passport.type2;Passport of Iraq (the coat of arms of Iraq on the middle in the top and barcode above the mrz zone, main page)
isl.drvlic.type1;Icelandic driving license (islands in the lower left and the coat of arms with the flag in the right, front side)
isl.drvlic.type2;Icelandic driving license (islands in the lower right, front side)
isl.drvlic.type3;Icelandic Driving License (Icelandic coats of arms on the background)
isl.passport.type1;Icelandic Passport (biometric symbol in the top-right corner and inscription Iceland on the background, main page)
isl.passport.type2;Icelandic Passport (biometric symbol in the top-right corner and inscription Iceland on the background, main page)
isl.rp.type1;Icelandic Residence Permit (Icelandic coat of arms on the right, front side)
isl.rp.type2;Icelandic Residence Permit (Icelandic coat of arms above the photo, front side)
isr.drvlic.type1;Driving License of Israel (the coat of arms of Israel in the top-right corner, front side)
isr.drvlic.type2;Driving License of Israel (the coat of arms of Israel in the top-right corner, blue sign in the top-left corner, front side)
isr.id.type1;ID card of Israel (chip on the left and a personal photo on the right, front side)
isr.id.type2;ID card of Israel (a personal photo in the top-left corner and the coat of arms of Israel on the background, front side)
isr.passport.type1;Passport of Israel (the coats of arms of Israel all over the background, main page)
isr.passport.type2;Passport of Israel (the coat of arms of Israel in the middle of the background, main page)
ita.drvlic.type1;Italian Driving License (new sample)
ita.drvlic.type2;Italian Driving License (old sample)
ita.health_insurance.type1;Italian Health Insurance (a coat of arms of Italia on the backgound, front side)
ita.health_insurance.type2;Italian Health Insurance (a coat of arms of Italia on the backgound and a chip on the left side, front side)
ita.id.type1;Italian ID Card (Italian emblen on the top, page 1)
ita.id.type2;Italian ID Card (Italian emblen in the top-left corner, front)
ita.id.type3;Italian ID Card (biometric symbol the top-left corner, front)
ita.passport.type1;Italian Passport (Italian emblem on the background, main page)
ita.rp.type1;Italian Residence Permit (biometric symbol on the top, front)
ita.rp.type2;Italian Residence Permit (chip on the left, back)
ita.rp.type3;Italian Residence Permit (black line on the top and right on the right, back)
ita.visa.type1;Italian Visa (ITA sign in the top-right corner, main page)
jam.drvlic.type1;Jamaica driving license (emblem in top left and photo in right)
jam.id.type1;Jamaica ID card (emblem in top left and flag and bird on background)
jam.passport.type1;Passport of Jamaica (inscription Jamaica on the background, main page)
jam.passport.type2;Passport of Jamaica (line of emblems under mrz and signature place on the left, main page)
jor.id.type1;Jordanian ID card (a building on the background and a personal photo on the left, front side)
jor.passport.type1;Jordanian Passport (a crown in the top-left corner of a personal photo, main page)
jpn.drvlic.type1;Japanese Driving License (a personal photo in the bottom- right corner, front side)
jpn.id.type1;Japanese ID Card (a rabbit in the top-right corner, front side)
jpn.insurance.type1;Japanese Health Insurance (a square in the bottom-right corner, front side)
jpn.passport.type1;Japanese Passport (Mount Fuji on the background and the Government Seal of Japan in the top-left and -right corner, main page)
jpn.rp.type1;Japanese residence permit (Photo on the right and a huge swan on the background, front side)
kaz.drvlic.type1;Kazakh Driving License (stamp with car on the middle, front)
kaz.drvlic.type2;Kazakh Driving License (chip on the right and Kazakh flag in the top-left corner, front)
kaz.id.type1;Kazakh ID Card (signature frame in the bottom, back)
kaz.id.type2;Kazakh ID Card (Kazakh flag in the down-right corner, front)
kaz.passport.type1;Kazakh Passport (stamp in the top-left corner on the photo, main page)
kaz.passport.type2;Kazakh Passport (Kazakh emblem on the bottom, main page)
kaz.passport.type3;Kazakh Passport (Kazakh emblem on the bottom, main page)
kaz.visa.type1;Kazakhstan Visa (contour of Kazakhstan in the top-left corner)
kaz.visa.type2;Kazakhstan Visa (circle of petals in the top-left corner)
kaz.vrc.type1;Kazakhstan Vehicle Registration Certificate (KZ sign on the top, back)
ken.id.type1;Kenyan ID Card (Kenyan coat of arms on the top and a fingerprint in the bottom-right corner, front side)
ken.passport.type1;Kenyan Passport (biometric symbol in the top-right corner and Kenyan coat of arms on the background, main page)
ken.passport.type2;Kenyan Passport (round stamp in the top-right corner and barcode above the mrz zone, main page)
kgz.drvlic.type1;Kyrgyz Driving License (KS sign in the top-left corner and the flag of Kyrgyzstan in the top-right corner, front side)
kgz.drvlic.type2;Kyrgyz Driving License (Red inscription Kyrgyz Republic in the national language at the top, front side)
kgz.id.type1;Kyrgyz ID card (the coat of arms of Kyrgyzstan in the middle on the top, front side)
kgz.id.type2;Kyrgyz ID card (the coat of arms of Kyrgyzstan in the top- left corner and biomentric symbol in the top-right corner, front side)
kgz.passport.type1;Kyrgyz passport (the coat of arms of Kyrgyzstan in the top- right corner near the small personal photo, main page)
kgz.vrc.type1;Kyrgyz Vehicle Registration Certificate (the flag of Kyrgyzstan in the top-right corner, front side, the coat of arms of Kyrgyzstan in the bottom-right, back side)
khm.passport.type1;Cambodian Passport (the coat of arms of Cambodia above the personal photo, main page)
